{
  "pageMeta": {
    "conclusion": "数据监测页当前先承接“公开且可复核”的真实信号，包括车辆保有量、PPI、基础金属、北美零售价格带与法规门槛；等后续接入海关和采购数据后，再替换为正式序列。",
    "evidence": "本页优先使用官方法规、国家统计局来源页面、公开商品行情站和零售渠道产品页面。",
    "risk": "行情站价格不等于企业采购价，零售页面价格也不等于出厂价，因此页面当前更适合作为外部信号板，而不是内部财务看板。",
    "visualizationSuggestion": "用三个轻量序列盯材料环境，用市场卡片盯准入与价格带，用状态卡提示计量与无线门槛。",
    "updatedAt": "2026-04-10",
    "sources": [
      {
        "id": "china-ppi",
        "sourceType": "commodity-tracker",
        "sourceTitle": "TradingEconomics：中国PPI变化页面及新闻摘要",
        "sourceUrl": "https://tradingeconomics.com/china/producer-prices-change/news/540783",
        "quotedAt": "2026-04-10",
        "note": "来源注明为国家统计局。"
      },
      {
        "id": "aluminum-live",
        "sourceType": "commodity-tracker",
        "sourceTitle": "TradingEconomics Aluminum",
        "sourceUrl": "https://tradingeconomics.com/commodity/aluminum",
        "quotedAt": "2026-04-10",
        "note": "提供基础金属外部行情信号。"
      }
    ],
    "confidence": "medium",
    "publishStatus": "reviewed",
    "lastReviewedAt": "2026-04-10",
    "dataMethod": "只放有公开来源的可复核外部信号，不虚构海关或采购序列。"
  },
  "dashboardMetrics": [
    {
      "id": "china-car-park",
      "label": "中国汽车保有量",
      "value": "3.53 亿辆",
      "delta": "2025 年底",
      "trend": "up",
      "sources": [
        {
          "id": "mofcom-vehicle-2026",
          "sourceType": "government-relay",
          "sourceTitle": "商务部价格监测中心转引公安部车辆数据",
          "sourceUrl": "https://price.mofcom.gov.cn/article/yjzx/hyzx/hy/202602/64237.html",
          "quotedAt": "2026-01-26",
          "note": "用于判断国内维护底盘。"
        }
      ],
      "confidence": "medium",
      "publishStatus": "reviewed",
      "lastReviewedAt": "2026-04-10",
      "dataMethod": "采用官方转引统计。"
    },
    {
      "id": "china-ppi-index",
      "label": "中国 PPI 同比",
      "value": "+0.5%",
      "delta": "2026-03 转正",
      "trend": "up",
      "sources": [
        {
          "id": "china-ppi",
          "sourceType": "commodity-tracker",
          "sourceTitle": "TradingEconomics：2026年3月中国PPI同比+0.5%",
          "sourceUrl": "https://tradingeconomics.com/china/producer-prices-change/news/540783",
          "quotedAt": "2026-04-10",
          "note": "来源注明为国家统计局。"
        }
      ],
      "confidence": "medium",
      "publishStatus": "reviewed",
      "lastReviewedAt": "2026-04-10",
      "dataMethod": "用宏观生产资料信号判断制造端成本环境。"
    },
    {
      "id": "aluminum-live",
      "label": "铝价",
      "value": "USD 3460/t",
      "delta": "2026-04-10",
      "trend": "up",
      "sources": [
        {
          "id": "aluminum-live",
          "sourceType": "commodity-tracker",
          "sourceTitle": "TradingEconomics Aluminum 商品页",
          "sourceUrl": "https://tradingeconomics.com/commodity/aluminum",
          "quotedAt": "2026-04-10",
          "note": "用于观察金属接口件外部行情。"
        }
      ],
      "confidence": "medium",
      "publishStatus": "reviewed",
      "lastReviewedAt": "2026-04-10",
      "dataMethod": "公开行情站信号，不等同于企业采购价。"
    },
    {
      "id": "retail-bundle",
      "label": "北美数字套装价带",
      "value": "USD 13.97-17.98",
      "delta": "Walmart 当前页面",
      "trend": "flat",
      "sources": [
        {
          "id": "walmart-aweltec-2pack",
          "sourceType": "marketplace",
          "sourceTitle": "Walmart AWELTEC 2 Pack Digital Tire Pressure Gauge",
          "sourceUrl": "https://business.walmart.com/ip/AWELTEC-Mesure-Digital-Tire-Pressure-Gauge-150-PSI-Non-Slip-2-Piece/2884869616",
          "quotedAt": "2026-04-10",
          "note": "当前页面显示约 USD 13.97。"
        },
        {
          "id": "walmart-astroai-3pack",
          "sourceType": "marketplace",
          "sourceTitle": "Walmart AstroAI 3 Pack Digital Tire Pressure Gauge",
          "sourceUrl": "https://www.walmart.com/ip/607329881",
          "quotedAt": "2026-04-10",
          "note": "当前页面显示约 USD 17.98。"
        }
      ],
      "confidence": "low",
      "publishStatus": "needs_review",
      "lastReviewedAt": "2026-04-10",
      "dataMethod": "当前公开零售页面价格，不等同于全市场中位数。"
    }
  ],
  "dashboardSeriesByRange": {
    "30D": [
      {
        "label": "铝价",
        "unit": "USD/t",
        "points": [
          { "period": "2026-03-06", "value": 3350 },
          { "period": "2026-04-10", "value": 3460 }
        ],
        "sources": [
          {
            "id": "aluminum-mar",
            "sourceType": "commodity-tracker",
            "sourceTitle": "TradingEconomics Aluminum News: March 2026",
            "sourceUrl": "https://tradingeconomics.com/commodity/aluminum/news/531332",
            "quotedAt": "2026-03-06",
            "note": "3 月初铝价约 3350 USD/t。"
          },
          {
            "id": "aluminum-live",
            "sourceType": "commodity-tracker",
            "sourceTitle": "TradingEconomics Aluminum",
            "sourceUrl": "https://tradingeconomics.com/commodity/aluminum",
            "quotedAt": "2026-04-10",
            "note": "4 月中旬页面约 3460 USD/t。"
          }
        ],
        "confidence": "medium",
        "publishStatus": "reviewed",
        "lastReviewedAt": "2026-04-10",
        "dataMethod": "取公开行情站的离散观测点。"
      },
      {
        "label": "锌价",
        "unit": "USD/t",
        "points": [
          { "period": "2026-03-31", "value": 3300 },
          { "period": "2026-04-10", "value": 3327.7 }
        ],
        "sources": [
          {
            "id": "zinc-mar",
            "sourceType": "commodity-tracker",
            "sourceTitle": "TradingEconomics Zinc News: March 2026",
            "sourceUrl": "https://es.tradingeconomics.com/commodity/zinc/news/537660",
            "quotedAt": "2026-03-31",
            "note": "3 月底锌价回到 3300 USD/t 上方。"
          },
          {
            "id": "zinc-live",
            "sourceType": "commodity-tracker",
            "sourceTitle": "TradingEconomics Zinc",
            "sourceUrl": "https://tradingeconomics.com/commodity/zinc",
            "quotedAt": "2026-04-10",
            "note": "4 月中旬页面约 3327.7 USD/t。"
          }
        ],
        "confidence": "medium",
        "publishStatus": "reviewed",
        "lastReviewedAt": "2026-04-10",
        "dataMethod": "取公开行情站离散点。"
      },
      {
        "label": "中国 PPI 同比",
        "unit": "%",
        "points": [
          { "period": "2026-02", "value": -0.9 },
          { "period": "2026-03", "value": 0.5 }
        ],
        "sources": [
          {
            "id": "china-ppi-index",
            "sourceType": "commodity-tracker",
            "sourceTitle": "TradingEconomics China Producer Prices",
            "sourceUrl": "https://tradingeconomics.com/china/producer-prices",
            "quotedAt": "2026-04-10",
            "note": "页面列出 2026 年 2 月指数 104.30、3 月同比转正。"
          }
        ],
        "confidence": "medium",
        "publishStatus": "reviewed",
        "lastReviewedAt": "2026-04-10",
        "dataMethod": "使用国家统计局来源的公开宏观信号。"
      }
    ],
    "90D": [
      {
        "label": "铝价",
        "unit": "USD/t",
        "points": [
          { "period": "2026-01-19", "value": 3200 },
          { "period": "2026-03-06", "value": 3350 },
          { "period": "2026-04-10", "value": 3460 }
        ],
        "sources": [
          {
            "id": "aluminum-jan",
            "sourceType": "commodity-tracker",
            "sourceTitle": "TradingEconomics Aluminum News: January 2026",
            "sourceUrl": "https://tradingeconomics.com/commodity/aluminum/news/518021",
            "quotedAt": "2026-01-19",
            "note": "1 月下旬铝价冲上 3200 USD/t。"
          },
          {
            "id": "aluminum-live",
            "sourceType": "commodity-tracker",
            "sourceTitle": "TradingEconomics Aluminum",
            "sourceUrl": "https://tradingeconomics.com/commodity/aluminum",
            "quotedAt": "2026-04-10",
            "note": "4 月中旬页面约 3460 USD/t。"
          }
        ],
        "confidence": "medium",
        "publishStatus": "reviewed",
        "lastReviewedAt": "2026-04-10",
        "dataMethod": "取 90 日关键价格节点。"
      },
      {
        "label": "锌价",
        "unit": "USD/t",
        "points": [
          { "period": "2026-01-26", "value": 3354 },
          { "period": "2026-03-31", "value": 3300 },
          { "period": "2026-04-10", "value": 3327.7 }
        ],
        "sources": [
          {
            "id": "zinc-jan",
            "sourceType": "commodity-tracker",
            "sourceTitle": "TradingEconomics Zinc News: January 2026",
            "sourceUrl": "https://tradingeconomics.com/commodity/zinc/news/519995",
            "quotedAt": "2026-01-26",
            "note": "1 月下旬锌价约 3354 USD/t。"
          },
          {
            "id": "zinc-live",
            "sourceType": "commodity-tracker",
            "sourceTitle": "TradingEconomics Zinc",
            "sourceUrl": "https://tradingeconomics.com/commodity/zinc",
            "quotedAt": "2026-04-10",
            "note": "4 月中旬页面约 3327.7 USD/t。"
          }
        ],
        "confidence": "medium",
        "publishStatus": "reviewed",
        "lastReviewedAt": "2026-04-10",
        "dataMethod": "取 90 日关键价格节点。"
      },
      {
        "label": "中国 PPI 同比",
        "unit": "%",
        "points": [
          { "period": "2026-01", "value": -1.4 },
          { "period": "2026-02", "value": -0.9 },
          { "period": "2026-03", "value": 0.5 }
        ],
        "sources": [
          {
            "id": "china-ppi-news",
            "sourceType": "commodity-tracker",
            "sourceTitle": "TradingEconomics PPI 新闻页面",
            "sourceUrl": "https://tradingeconomics.com/china/producer-prices-change/news/540783",
            "quotedAt": "2026-04-10",
            "note": "显示 2026 年 3 月同比 +0.5%，前值为负。"
          }
        ],
        "confidence": "medium",
        "publishStatus": "reviewed",
        "lastReviewedAt": "2026-04-10",
        "dataMethod": "按月取国家统计局来源的公开同比数据。"
      }
    ],
    "12M": [
      {
        "label": "铝价",
        "unit": "USD/t",
        "points": [